"The Greenbrier Companies, Inc. (NYSE:GBX) Q2 2019 Earnings Conference Call April 5, 2019 11:00 AM ET"
Company Participants
Justin Roberts - Vice President and Treasurer
Bill Furman - Chairman and Chief Executive Officer
Lorie Tekorius - Executive Vice President and Chief Operating Officer
Adrian Downes - Senior Vice President and Acting Chief Financial Officer
Conference Call Participants
Justin Long - Stephens
Matt Brooklier - Buckingham Research
Allison Poliniak - Wells Fargo
Bascome Majors - Susquehanna
Steve Barger - KeyBanc Capital Markets
Matt Elkott - Cowen & Company
Ken Hoexter - Bank of America Merrill Lynch
Operator
"Hello and welcome to The Greenbrier Companies Second Quarter of Fiscal Year 2019 Earnings Conference Call. Following today's presentation, we will conduct a question-and-answer session. Each analyst should limit themselves to only two questions. Until that time, all lines will be on a listen-only mode. At the request of The Greenbrier Companies, this conference call is being recorded for instant replay purposes."
"At this time, I'd like to turn over the conference over to Mr. Justin Roberts, Vice President and Treasurer. Mr. Roberts you may begin."
Justin Roberts
"Thank you, Angela. Good morning. Welcome to our second quarter conference call. On today's call, I'm joined by Greenbrier's Chairman and CEO, Bill Furman; Lorie Tekorius, Executive Vice President and COO; and Adrian Downes, Senior Vice President and Acting CFO. They will discuss the results for the quarter and provide an outlook for Greenbrier's business in fiscal 2019. Following our introductory remarks, we will open up the call for questions."
"In addition to the press release issued this morning, which includes supplemental data, additional financial information and key metrics can be found in a slide presentation posted today on the IR section of our website."
"Matters discussed on today's conference call include forward-looking statements within the meaning of the Private Securities Litigation Reform Act of 1995. Throughout our discussion today, we will describe some of the important factors that could cause Greenbrier's actual results in 2019 and beyond to differ materially from those expressed in any forward-looking statement made by or on behalf of Greenbrier."
"And with that, I'll ask Bill to take it away."
Bill Furman
"Okay. Thank you very much, Justin, and good morning, everyone. Highlights of Greenbrier's second fiscal quarter included a solid railcar order activity and increased railcar deliveries and revenue generation. But our financial performance in the quarter was obviously disappointing."
"Our 2019 plan identified our second quarter as the least profitable of the year, due to -- in part to expected manufacturing inefficiencies from production line changeovers and building of a fleet of cars for syndication."
"However, we also encountered three distinct headwinds mentioned in our press release that impacted profitability in the quarter, specifically challenges in manufacturing at our Romanian and Gunderson facilities and facility closure costs in railcar repair operations. These factors caused second quarter earnings per share to fall short of our goals."
"Despite these challenges, during the quarter our projected deliveries and revenue for the year remain on target. Ergo, we now estimate fiscal 2019 earnings per share in the range of $3.60 to $3.80, excluding the railcar contract loss accruals and facility closure costs incurred during the quarter. Adrian will discuss our second quarter financial results and full year financial guidance in more detail."
"While lower than our previous outlook, we are confident in Greenbrier's ability to perform within this range. We have identified the core issues creating the negative financial performance in our Romanian facilities in particular and our Gunderson operations and our railcar repair network."
"By far, the Romanian operations were the most significant and we believe we have a new handle -- a handle on that with new management under the leadership of long-time Greenbrier officer, William Glenn, who used to run our European operations and has recently rejoined the company. We are also making rapid progress in addressing other performance issues that impacted the quarter."
"I'll briefly offer observations on the current conditions we see in the market and impact -- potential impact to our business. Recent macroeconomic data indicates the U.S. economy is still growing at a slightly smaller pace, in excess of 2.2% of GDP real growth."
"Core inflation remains low, at approximately 2% and the U.S. Federal Reserve is projecting no interest rate hikes in 2019 and continues to signal cautiously into 2020. Overall, low inflation and less restrictive monetary policy in the United States and North America should allow for GDP expansion throughout the balance of the year into 2020 and possibly into 2021."
"Throughout March, North American rail traffic is down year-over-year. This is in part due to harsh winter weather conditions and declines in some commodity areas. Although, car loadings are down, intermodal activity remains fairly constant from 2018 levels and train velocity continues to be negative. Greenbrier continues to -- and part of that is due, of course, to weather and flooding."
"Greenbrier continues to closely monitor the rollout of Precision Scheduled Railroading, also known as PSR, at various Class one railroads. While this is not a new initiative and is not being implemented by all railroads, it is a trend that merits attention and we're tracking it closely."
"It has both potential negatives and potential positives to car builders and leasing companies. Although, Greenbrier is not presently experiencing any direct impact from PSR, we will be quick to act on any effects it may produce over time in the railroad equipment and services market."
One of our defining characteristics is the ability to navigate shifting market dynamics with responsive products and services and to address issues when they arise. So we hope to get past this quarter and begin a more normalized performance pattern. Our strategy of reinforcing the core North American market is succeeding with almost all fiscal 2019 production slots filled and moving into 2020. Our integrated team is working to fulfill and fill those.
"In Europe, customer inquiries remain solid. Greenbrier-Astra Rail is in active negotiations with several railcar fleet owners for multi-year orders. There's also been considerable activity in the intermodal sector in Europe, in part, driven by the availability of EU funds, designed to take container traffic off the roads to help the continent meet its ambitious carbon reduction goals."
"Finally, in Brazil, the economy gained momentum in February after a pause during the presidential transition. During fiscal 2019, we've refocused on strategically reorganizing the size of manufacturing facilities there, operated as part of our Greenbrier-Maxion joint venture. We believe we're well positioned as gradual economic recovery and the grants of rail concessions takes hold in this year. Our long-term view of the opportunity in Brazil remains very positive."
"Greenbrier expects a stronger finish to the second half of fiscal 2019. As we have indicated before, our strategy is to continue to deliver on the four elements we articulated at the beginning of fiscal 2019: reinforcing our core North American markets; executing on our international strategy."
"Although, we believe that footprint will be stabilized and not be expanding. We won't be emphasizing additional growth other than those things that we've announced. Robust development, number three of the talent pipeline, and continuing to grow the business on a larger scale."
"With that, I'll turn it back to Lorie and Justin and Adrian."
Lorie Tekorius
"Thank you, Bill. Good morning, everyone. I'll briefly provide some more detail on our operating performance before Adrian addresses the financial detail."
"We delivered 5,100 railcar units and received orders for approximately 3,800 units valued at nearly $450 million. Orders in the quarter were for a broad range of car types, including covered hoppers, automotive-carrying railcars and tank cars. Our diversified backlog as of quarter-end totaled 26,000 units with an estimated value of $2.7 billion."
"As Bill mentioned and as detailed in our press releases of today and March 22, challenges in Romania, Gunderson and our railcar repair operations negatively impacted results in the quarter by $0.29 per share, which includes $0.14 related to loss accruals on certain railcar contracts and facility closure costs. With about 95% of 2019 production booked, manufacturing execution is critical and we believe we've identified the right solutions to achieve our updated performance targets in the second half of the year."
"I'll now give a bit more color on those solutions. First, in Europe. As Bill said, effective February 1 William Glenn rejoined Greenbrier as the CEO of Greenbrier-Astra Rail, our integrated rail -- European rail operation with facilities in Romania, Poland and Turkey."
"William initially joined Greenbrier in 2003 and over 13 years with Greenbrier, he held several executive positions in both North America and Europe. William's familiarity with Greenbrier, its European operations, which recently doubled in size and his expertise in operational turnaround will expedite the required changes in Europe."
"In his new role William directs all European strategic and commercial activity and he'll work closely with Martin Graham, our Executive Vice President of Manufacturing, who adds Chief Operating Officer of Greenbrier-Astra Rail to his responsibilities. Together William and Martin have a mandate to improve operating profitability in Greenbrier Europe."
"Second, at Gunderson, we expect operational and financial improvement at Gunderson as we restart a railcar production line and eliminate the distraction of production automation activities and hit our stride in marine, where in January we received an order from Overseas Shipholding Group, OSG to construct a second 204,000 barrels oil and chemical ATB barge."
"And lastly, in repair, since we regained direct control of our North American railcar repair shops in September, we've been strategically reviewing the network. At unprofitable locations, we first focus our efforts on improving the volume and mix of work. After this, if we determined that a location cannot be profitable, we explore the sale to another operator, before reaching a final determination to cease operations."
"In the second quarter, after ensuring fair treatment was given to our employees, we announced plans to conclude operations at two repair locations. And although, the repair site evaluation continues, we're optimistic about the progress we have made in rationalizing our network and intend to achieve significantly improved operating performance by the end of 2019. And beyond the challenges presented in the quarter there were several positives to share."
"Leasing revenue was particularly strong resulting from a substantial uptick in syndication activity. And to meet syndication demand, some of these products were sourced from outside of our own manufacturing operations. Excluding those products, gross margin in Leasing & Services exceeded 51%. Also in the second quarter, Greenbrier Management Services, our proprietary rail management provider grew its customer base with seven new customers under contract, while securing several multi-year renewals from existing customers."
"Wheels & Parts were also positive contributors to Greenbrier’s performance. As Bill mentioned, winter weather slowed railcar loading, but it was a tailwind to our wheels business. One-third of our wheels locations operated on a seven-day schedule through the winter months to meet high demand. Our parts group also delivered a strong quarter led by the production of boxcar doors from our Ohio facility and continued demand for end-of-car cushioning units from our Iowa operations."
"Moving beyond our North American and European operations, Brazil remains a challenging environment, but the economy is improving. And with our joint venture partners, Amsted Rail and Iochpe-Maxion we sized our operations to be poised to respond, when rail demand improves."
"Greenbrier continues to pursue opportunities to achieve growth at scale. We endeavor to do this where scale actuates the other elements of our strategy, reinforcing the company's position in core North American markets, executing in international railcar markets, and growing our talent pipeline for the future. Although, we encountered obstacles in the second quarter, everything we face is addressable and solutions are underway to achieve the goals for 2019 and beyond. Our team is dedicated to meeting our objectives and we continue to be excited about what the future holds for Greenbrier."
"Adrian, I'll turn it over to you to talk about the quarterly financials and our full year guidance."
Adrian Downes
"Thank you, Lorie and good morning everyone."
"Quarterly financial information and metrics are available in the press release and supplemental slides on our website. Given the discussion so far, I'll focus on a few additional details in the quarter and then provide additional information on our fiscal year 2019 guidance."
"Highlights for the second quarter includes net earnings attributable to Greenbrier of $2.8 million, or $0.08 per share, including $4.7 million net of tax, or $0.14 per share of railcar contract loss accruals and manufacturing and closure costs in the repair operations. Adjusted EBITDA of $37.4 million included $7.6 million of an impact from the contract loss accruals and closure costs."
"Revenue was $658.7 million, up 9% sequentially. Almost 30% of our 5,100 units delivered were outside the North American market. Internally produced, syndication activity accounted for another 1,200 units delivered in the quarter. 10% to 15% of the order activity in the quarter was from international markets."
Orders continue to be broad-based across a variety of railcar types and customers. Aggregate gross margin of 8.2% was below our expectations as a result of the factors already mentioned.
"As we move beyond the production disruptions in the second quarter, we expect gross margins to move back into the double-digits during the second half of the year. We continue to be focused on growing the business and remain optimistic about the opportunities supported by our balance sheet strength and flexibility. Available liquidity of almost $900 million including over $340 million of cash positions us well to support our strategic objective to grow at scale."
"I'm going to spend a few extra minutes discussing the working capital growth that has occurred over the last two quarters, much of which is driven by increasing business activity levels."
"Inventory balances increased, reflecting preparation for substantially higher expected production rates in the second half of fiscal 2019 as well as the outsourcing of lining work on several car types. This has increased the length of time to produce cars meaning they are staying in inventory longer than is typical and this will reverse in the fourth quarter as additional internal lining capacity is brought online. All else being equal, we expect cash balances to exceed $500 million by the end of the year."
We continue to focus on activities that emphasize cash flow generation and return on capital employed. We believe this approach will continue to create long-term shareholder value supported by our history of steady dividend increases over the last several years. We are confident in our dividend policy and the $0.25 per share quarterly dividend announced today is our 20th consecutive quarterly dividend and represents a yield of over 3%.
"Based on current business trends, we're updating our fiscal 2019 guidance, deliveries to be approximately 24,000 to 26,000 units, which includes about 2,000 units from Greenbrier-Maxion in Brazil. Revenue will exceed $3 billion, diluted EPS of $3.60 to $3.80 excluding the $0.14 per share related to railcar contract loss accruals and closure costs in Q2."
Our updated earnings guidance reflects the impact of Q2 as well as somewhat lower earnings expectations for the balance of the year in the affected operations. The majority of our prior guidance is unchanged. Operating cash flow will be positive and given the earnings trajectory will be weighted to the back end of the year.
"G&A expense of $205 million to $210 million includes continued support for strategic initiatives including investments in our talent base. We will continue to rebalance our lease fleet and expect gains on sale of about $40 million on $120 million of proceeds from those sales. Similar to 2018, we intend to continue adding to our fleet, with expected investments of about $100 million."
"We expect capital expenditures of $105 million in manufacturing and wheels, repair and parts. Combined with our fleet activity, our net capital expenditure will be about $75 million. Depreciation and amortization is expected to be $80 million to $85 million and earnings from unconsolidated affiliates are expected to be breakeven to modestly positive in 2019."
We expect 2019 earnings attributable to non-controlling interest to be about $40 million and our consolidated tax rate for 2019 is expected to be 25% to 26%. Our rates will fluctuate due to the geographic mix of earnings and other discrete items.
"Operator, we'll now open it up for questions. Operator, we'll now open it up for questions."
Question-and-Answer Session
Operator
Thank you. We will now begin the question-and-answer session. [Operator Instructions] Our first question comes from Justin Long with Stephens. Your line is open.
Justin Long
"Thanks and good morning. So I wanted to start with a question on the $7.6 million charge that you called out. Can you share how much of that was allocated to the Wheels & Parts segment and how much of that was allocated to the manufacturing segment? And then just thinking about manufacturing margins, is there a way to size up the operational headwind that you saw from Europe and Gunderson? Just curious if there's a way to quantify what that was in the quarter."
Adrian Downes
"Yes. So the closure costs in our repair business was $1.1 million, so the other items related to manufacturing are $6.5 million. So the bulk of it was in manufacturing."
Lorie Tekorius
"And Justin could you repeat the rest of your question? Sorry, I got a little bit lost."
Justin Long
"Sure, no problem. Second part was just on the operational headwinds in Europe and in Gunderson, and if there is any way to call out what that impact was as we think about a more normalized margin going forward?"
Lorie Tekorius
Right. So I would say that we did have headwinds beyond what we talked about on the job loss accruals. We had some definite inefficiencies in both Europe and at Gunderson that are part of the larger number that we called out in the earnings release.
"You've been through our shops, so you know that these things don't necessarily turn on a dime, but we didn't wait until the quarter finished to start making adjustments. So we have activities underway and we expect modest improvement in the third quarter and even better improvement in the fourth."
Justin Long
"Okay. And then for my second question, I wanted to circle back to a comment that you made Bill that you won't be emphasizing growth in some of the international markets beyond what you've already announced. Can you just comment on your longer-term view of the international businesses? I'm curious if your opinion on the earnings power or margin potential in those international businesses has changed. Or is this just simply a case where the processes in Europe weren't where they need to be and now you changed management and we should see the issues resolved pretty quickly?"
Bill Furman
"Okay. Just simply with regard to international strategy, we believe that it will ultimately result in diversity of revenue and earnings by having footprints in different locations. However, given the nature of the hit in Europe and the disappointments there, we need to regroup and ensure that we have all of that under control."
"We're also working carefully in Brazil, the GCC and Turkey, which is a very small footprint right now. We think that it's best to consolidate our activities and have a strong profitable base before we do more to expand. But those are the regions that where we are currently operating. So I think that answers both aspects of your question."
Adrian Downes
And Justin we did call out $0.29 of performance issues at those units. That did include the loss contract accruals as well as the closure costs.
Bill Furman
"Yes. Not at all with units I mentioned, but just in Europe, Gunderson facility and then the continuing assimilation of the shop network at -- within our Wheels & Parts group, but it's the repair business. The actual Wheel & Parts business as Lorie mentioned, offset some of that in the repair side."
Justin Long
Okay. That's helpful. And one just last quick modeling question on incentive comp. Could you comment on how that assumption has changed versus your prior forecast?
Bill Furman
"Our incentive comp goes down if our expectations go down, and -- but Lorie can probably give a more precise figure Justin or answer to that."
Lorie Tekorius
I think that's spot on. It's yes. As our results decline our incentive compensation declines. We also -- the incentive compensation is expensed pro rata consistent with when we have quarters of earnings. So we would expect higher -- if the back half is going to have higher earnings it will have higher expense.
Justin Long
Okay. But there's not a dollar amount that you can share that in terms of the change from prior guidance to the guidance you gave today?
Lorie Tekorius
"No, not at this time."
Justin Long
Okay. Fair enough. I’ll leave it at that. I appreciate the time.
Bill Furman
Thank you Justin.
Operator
Our next question comes from Matt Elkott with Cowen. Your line is open.
Matt Elkott
Good morning. How are you guys? First I have just a maintenance question on the guidance. I want to make sure I got this right. Did you guys say that the net gain on disposition of equipment guidance was unchanged at around $40 million?
Bill Furman
That's correct.
Adrian Downes
Yes.
Matt Elkott
"Okay. So the second half should be lower because the first half if you annualize it, it would be closer to $52 million."
Bill Furman
"Exactly, yes. The Q3 and Q4 will be at a lower run rate."
Matt Elkott
"Okay. That's very helpful. My next question is based on your expected deliveries for the second half, the 95% that's already in the backlog, I think you will be left with just over 11,000 units beyond fiscal 2019. So how much of that or what percentage of that is for fiscal 2020 or beyond? And based on the current order activity and the delivery schedules, do you think 2020 could be an EPS growth year?"
Lorie Tekorius
"We always seek to have the next year be an EPS growth year. Regarding where we sit right now on backlog and how our production space is filled into 2020, we're feeling good, but we're also in the rail freight business, so we never feel really good. Our guys are working hard every day to fill that space."
"We do have some orders that continue into 2021. I don't think any beyond 2021. Maybe just a little bit. But I would say, the bulk of the backlog that goes from out of 2019 is in 2020 with a little bit going into 2021 and 2022. It's hard for me to think about years that big."
Matt Elkott
"Okay. And Lorie, how has the order and inquiry activity been since the end of the quarter?"
Bill Furman
"Since the end of the quarter, we continue to see a lot of visibility in various tank car markets, plastics and other derivative products. We're also seeing strong demand in some commodity types of gondolas for example, a little weaker demand in some car types. But in general, we think we have very good momentum into 2020 and even some visibility as Lorie mentioned into 2021."
Matt Elkott
"Okay. So on the tank car front Bill you mentioned -- I guess the tank car outlook continues to be pretty positive, or have you seen any recent signs that customers are maybe having second thoughts on pulling the trigger on those orders? And also what are the manufacturing lead times for tank cars?"
Bill Furman
The lead times are anywhere from six to 12 months depending on the type. We haven't seen a lot of hesitation. But I would suggest that -- we don't want to confuse the mix and think it's all crude by rail. There's a broad tank car segment that has a lot of activity going on in it.
MattElkott
Okay. Do you have a sense of how much of the tank car activity is for replacement of older tank cars versus new demand?
Bill Furman
I think that's a significant factor.
Matt Elkott
Okay. All right.
Bill Furman
But I don't have a statistic to share.
Matt Elkott
Great. Very helpful. Thank you very much.
Bill Furman
"Thank you, Matt."
Lorie Tekorius
"Thanks, Matt."
Operator
Our next question comes from Allison Poliniak with Wells Fargo. Your line is open.
Allison Poliniak
"Hi, guys. Good morning. Lorie, I wanted to go back. I think you were talking about automation and some of the issues that you had in the quarter. Can you just give us your high-level thoughts? Is automation just not a process that's going to work? And rail car manufacturing, is it something that you're reworking to go back? Any thoughts there?"
Lorie Tekorius
